{
  "$schema": "https://json-schema.org/draft/2020-12/schema",
  "$id": "https://raw.githubusercontent.com/api-evangelist/weather-gov/refs/heads/main/json-schema/weather-gov-text-product-schema.json",
  "title": "TextProduct",
  "description": "TextProduct schema from weather.gov API",
  "type": "object",
  "properties": {
    "@context": {
      "$ref": "#/components/schemas/JsonLdContext"
    },
    "@id": {
      "type": "string",
      "format": "uri"
    },
    "id": {
      "type": "string"
    },
    "wmoCollectiveId": {
      "type": "string"
    },
    "issuingOffice": {
      "type": "string"
    },
    "issuanceTime": {
      "type": "string",
      "format": "date-time"
    },
    "productCode": {
      "type": "string"
    },
    "productName": {
      "type": "string"
    },
    "productText": {
      "type": "string"
    }
  },
  "additionalProperties": false
}